{
  "$registry": {
    "component": "double-spin-box",
    "version": "2.0"
  },
  "$status": "active",
  "base": {
    "state": {
      "default": {
        "slot": {
          "container": {
            "radius": {
              "$type": "borderRadius",
              "$value": "{semantic.radius.control-default}",
              "$description": "Recovered from legacy V2 layer component.double-spin-box.base.default.container.radius",
              "$sourceOwner": "old-tree-recovery",
              "unit": "px"
            },
            "visual-height": {
              "$type": "dimension",
              "$value": "{primitive.dimension.32}",
              "$description": "Recovered from legacy V2 layer component.double-spin-box.base.default.container.visual-height",
              "$sourceOwner": "old-tree-recovery",
              "unit": "px"
            }
          }
        }
      }
    }
  },
  "overrides": []
}
