{
  "$registry": {
    "component": "lcd-number",
    "version": "2.0"
  },
  "$status": "active",
  "base": {
    "state": {
      "default": {
        "slot": {
          "digit": {
            "color": {
              "$type": "color",
              "$value": "{semantic.color.text.primary}",
              "$description": "Recovered from legacy V2 layer component.lcd-number.base.default.digit.color",
              "$sourceOwner": "old-tree-recovery"
            }
          }
        }
      },
      "disabled": {
        "slot": {
          "digit": {
            "color": {
              "$type": "color",
              "$value": "{semantic.color.text.disabled}",
              "$description": "Recovered from legacy V2 layer component.lcd-number.base.disabled.digit.color",
              "$sourceOwner": "old-tree-recovery"
            }
          }
        }
      }
    }
  },
  "overrides": []
}
