{
  "$registry": {
    "component": "desktop-bottom-navigation",
    "version": "2.0"
  },
  "$status": "active",
  "base": {
    "state": {
      "default": {
        "slot": {
          "primary": {
            "item-gap": {
              "$type": "spacing",
              "$value": "{semantic.space.icon-text}",
              "$description": "Recovered from legacy V2 layer component.desktop-bottom-navigation.base.default.primary.item-gap",
              "$sourceOwner": "old-tree-recovery",
              "unit": "px"
            }
          },
          "secondary": {
            "item-gap": {
              "$type": "spacing",
              "$value": "{semantic.space.icon-text}",
              "$description": "Recovered from legacy V2 layer component.desktop-bottom-navigation.base.default.secondary.item-gap",
              "$sourceOwner": "old-tree-recovery",
              "unit": "px"
            },
            "padding-block": {
              "$type": "spacing",
              "$value": "{semantic.space.icon-text}",
              "$description": "Recovered from legacy V2 layer component.desktop-bottom-navigation.base.default.secondary.padding-block",
              "$sourceOwner": "old-tree-recovery",
              "unit": "px"
            }
          },
          "tier": {
            "gap": {
              "$type": "spacing",
              "$value": "{semantic.space.icon-text}",
              "$description": "Recovered from legacy V2 layer component.desktop-bottom-navigation.base.default.tier.gap",
              "$sourceOwner": "old-tree-recovery",
              "unit": "px"
            }
          }
        }
      }
    }
  },
  "overrides": []
}
