{
  "$registry": {
    "component": "dialog-button-group",
    "version": "2.0"
  },
  "$status": "active",
  "base": {
    "state": {
      "default": {
        "slot": {
          "button-row": {
            "gap": {
              "$type": "spacing",
              "$value": "{semantic.space.icon-text}",
              "$description": "Recovered from legacy V2 layer component.dialog-button-group.base.default.button-row.gap",
              "$sourceOwner": "old-tree-recovery",
              "unit": "px"
            },
            "min-height": {
              "$type": "dimension",
              "$value": "{semantic.interaction-size.default}",
              "$description": "Recovered from legacy V2 layer component.dialog-button-group.base.default.button-row.min-height",
              "$sourceOwner": "old-tree-recovery",
              "unit": "px"
            }
          },
          "container": {
            "padding-block": {
              "$type": "spacing",
              "$value": "{semantic.layout.padding.block.standard}",
              "$description": "Recovered from legacy V2 layer component.dialog-button-group.base.default.container.padding-block",
              "$sourceOwner": "old-tree-recovery",
              "unit": "px"
            },
            "padding-inline": {
              "$type": "spacing",
              "$value": "{semantic.layout.padding.inline.standard}",
              "$description": "Recovered from legacy V2 layer component.dialog-button-group.base.default.container.padding-inline",
              "$sourceOwner": "old-tree-recovery",
              "unit": "px"
            }
          }
        }
      }
    }
  },
  "overrides": []
}
