{
  "$registry": {
    "component": "checkbox",
    "version": "2.0"
  },
  "$status": "active",
  "base": {
    "size": {
      "large": {
        "slot": {
          "indicator": {
            "size": {
              "$type": "dimension",
              "$value": "{semantic.visualization-size.md}",
              "$description": "Recovered from legacy V2 layer component.checkbox.size.large.indicator.size",
              "$sourceOwner": "old-tree-recovery",
              "unit": "px"
            }
          }
        }
      },
      "small": {
        "slot": {
          "indicator": {
            "size": {
              "$type": "dimension",
              "$value": "{semantic.visualization-size.sm}",
              "$description": "Recovered from legacy V2 layer component.checkbox.size.small.indicator.size",
              "$sourceOwner": "old-tree-recovery",
              "unit": "px"
            }
          }
        }
      }
    },
    "state": {
      "default": {
        "slot": {
          "content": {
            "gap": {
              "$type": "spacing",
              "$value": "{semantic.space.icon-text}",
              "$description": "Recovered from legacy V2 layer component.checkbox.base.default.content.gap",
              "$sourceOwner": "old-tree-recovery",
              "unit": "px"
            }
          },
          "indicator": {
            "background-color": {
              "$type": "color",
              "$value": "{semantic.color.background.control-default}",
              "$description": "Recovered from legacy V2 layer component.checkbox.base.default.indicator.background-color",
              "$sourceOwner": "old-tree-recovery"
            },
            "border-color": {
              "$type": "color",
              "$value": "{semantic.color.border.default}",
              "$description": "Recovered from legacy V2 layer component.checkbox.base.default.indicator.border-color",
              "$sourceOwner": "old-tree-recovery"
            },
            "border-width": {
              "$type": "borderWidth",
              "$value": "{semantic.border-width.boundary-default}",
              "$description": "Recovered from legacy V2 layer component.checkbox.base.default.indicator.border-width",
              "$sourceOwner": "old-tree-recovery",
              "unit": "px"
            },
            "radius": {
              "$type": "borderRadius",
              "$value": "{semantic.radius.control-default}",
              "$description": "Recovered from legacy V2 layer component.checkbox.base.default.indicator.radius",
              "$sourceOwner": "old-tree-recovery",
              "unit": "px"
            }
          },
          "label": {
            "color": {
              "$type": "color",
              "$value": "{semantic.color.text.primary}",
              "$description": "Recovered from legacy V2 layer component.checkbox.base.default.label.color",
              "$sourceOwner": "old-tree-recovery"
            },
            "font-size": {
              "$type": "fontSize",
              "$value": "{semantic.typography.body.default.font-size}",
              "$description": "Recovered from legacy V2 layer component.checkbox.base.default.label.font-size",
              "$sourceOwner": "old-tree-recovery",
              "unit": "px"
            },
            "font-weight": {
              "$type": "fontWeight",
              "$value": "{semantic.typography.font-weight.body}",
              "$description": "Recovered from legacy V2 layer component.checkbox.base.default.label.font-weight",
              "$sourceOwner": "old-tree-recovery"
            },
            "letter-spacing": {
              "$type": "letterSpacing",
              "$value": "{semantic.typography.letter-spacing.default}",
              "$description": "Recovered from legacy V2 layer component.checkbox.base.default.label.letter-spacing",
              "$sourceOwner": "old-tree-recovery",
              "unit": "px"
            },
            "line-height": {
              "$type": "lineHeight",
              "$value": "{semantic.typography.body.default.line-height}",
              "$description": "Recovered from legacy V2 layer component.checkbox.base.default.label.line-height",
              "$sourceOwner": "old-tree-recovery",
              "unit": "px"
            }
          }
        }
      },
      "disabled": {
        "slot": {
          "indicator": {
            "background-color": {
              "$type": "color",
              "$value": "{semantic.color.background.disabled}",
              "$description": "Recovered from legacy V2 layer component.checkbox.base.disabled.indicator.background-color",
              "$sourceOwner": "old-tree-recovery"
            },
            "border-color": {
              "$type": "color",
              "$value": "{semantic.color.border.secondary}",
              "$description": "Recovered from legacy V2 layer component.checkbox.base.disabled.indicator.border-color",
              "$sourceOwner": "old-tree-recovery"
            },
            "selected-border-color": {
              "$type": "color",
              "$value": "{semantic.color.background.surface}",
              "$description": "Recovered from legacy V2 layer component.checkbox.base.disabled.indicator.selected-border-color",
              "$sourceOwner": "old-tree-recovery"
            }
          },
          "label": {
            "color": {
              "$type": "color",
              "$value": "{semantic.color.text.disabled}",
              "$description": "Recovered from legacy V2 layer component.checkbox.base.disabled.label.color",
              "$sourceOwner": "old-tree-recovery"
            }
          }
        }
      },
      "focused": {
        "slot": {
          "focus-ring": {
            "color": {
              "$type": "color",
              "$value": "{semantic.color.interactive.brand.default}",
              "$description": "Recovered from legacy V2 layer component.checkbox.base.focused.focus-ring.color",
              "$sourceOwner": "old-tree-recovery"
            },
            "width": {
              "$type": "borderWidth",
              "$value": "{semantic.border-width.focus-ring}",
              "$description": "Recovered from legacy V2 layer component.checkbox.base.focused.focus-ring.width",
              "$sourceOwner": "old-tree-recovery",
              "unit": "px"
            }
          }
        }
      },
      "hover": {
        "slot": {
          "indicator": {
            "color": {
              "$type": "color",
              "$value": "{semantic.color.interactive.brand.hover}",
              "$description": "Recovered from legacy V2 layer component.checkbox.base.hover.indicator.color",
              "$sourceOwner": "old-tree-recovery"
            }
          }
        }
      },
      "pressed": {
        "slot": {
          "indicator": {
            "color": {
              "$type": "color",
              "$value": "{semantic.color.interactive.brand.pressed}",
              "$description": "Recovered from legacy V2 layer component.checkbox.base.pressed.indicator.color",
              "$sourceOwner": "old-tree-recovery"
            }
          }
        }
      }
    },
    "value": {
      "checked": {
        "slot": {
          "indicator": {
            "color": {
              "$type": "color",
              "$value": "{semantic.color.interactive.brand.default}",
              "$description": "Recovered from legacy V2 layer component.checkbox.base.selected.indicator.color",
              "$sourceOwner": "old-tree-recovery"
            }
          }
        }
      }
    }
  },
  "overrides": []
}
